{
  "schemaVersion": 3,
  "id": "preview-2026-07-25",
  "generatedAt": "2026-07-25T23:30:00Z",
  "source": {
    "repository": "pawnkit/pawn-actions",
    "commit": "1111111111111111111111111111111111111111"
  },
  "targets": ["linux-amd64"],
  "profiles": ["openmp"],
  "components": [
    {
      "name": "pawn",
      "repository": "pawnkit/pawnkit-cli",
      "version": "v1.3.0",
      "commit": "2222222222222222222222222222222222222222",
      "artifacts": [
        {
          "target": "linux-amd64",
          "url": "https://github.com/pawnkit/pawnkit-cli/releases/download/v1.3.0/pawn-linux-amd64.tar.gz",
          "size": 1234,
          "checksum": "sha256:bbbbbbbbbbbbbbbbbbbbbbbbbbbbbbbbbbbbbbbbbbbbbbbbbbbbbbbbbbbbbbbb",
          "sbom": {
            "url": "https://github.com/pawnkit/pawnkit-cli/releases/download/v1.3.0/pawn-linux-amd64.tar.gz.sbom.json",
            "size": 5678,
            "checksum": "sha256:cccccccccccccccccccccccccccccccccccccccccccccccccccccccccccccccc"
          },
          "provenance": {
            "repository": "pawnkit/pawnkit-cli",
            "workflow": "https://github.com/pawnkit/pawnkit-cli/.github/workflows/release.yml@refs/tags/v1.3.0",
            "subject": "sha256:bbbbbbbbbbbbbbbbbbbbbbbbbbbbbbbbbbbbbbbbbbbbbbbbbbbbbbbbbbbbbbbb"
          }
        }
      ]
    }
  ],
  "moduleGraph": [
    {
      "repository": "pawnkit/pawnkit-cli",
      "module": "github.com/pawnkit/pawnkit-cli",
      "version": "v1.3.0",
      "commit": "2222222222222222222222222222222222222222",
      "dependencies": [
        {
          "repository": "pawnkit/pawn-project",
          "version": "v0.3.0",
          "kind": "runtime"
        }
      ]
    },
    {
      "repository": "pawnkit/pawn-project",
      "module": "github.com/pawnkit/pawn-project",
      "version": "v0.3.0",
      "commit": "3333333333333333333333333333333333333333",
      "dependencies": []
    }
  ],
  "schemas": [
    {
      "name": "pawn-release-set",
      "version": 3,
      "url": "https://schemas.pawnkit.dev/pawn-release-set/v3/schema.json",
      "checksum": "sha256:aaaaaaaaaaaaaaaaaaaaaaaaaaaaaaaaaaaaaaaaaaaaaaaaaaaaaaaaaaaaaaaa"
    }
  ],
  "evidence": {
    "workflow": "https://github.com/pawnkit/pawn-actions/actions/runs/123456789",
    "commit": "1111111111111111111111111111111111111111",
    "completedAt": "2026-07-25T23:20:00Z",
    "projects": ["pawn-corpus/projects/minimal-openmp"],
    "targets": ["linux-amd64"]
  },
  "knownLimits": []
}

